{
  "channel": "local-dev",
  "version": "1.1.0",
  "gitSha": "fedcba9876543210fedcba9876543210fedcba98",
  "releasedAt": "2026-08-24T12:00:00Z",
  "notes": {
    "summary": "Windows launcher update foundation for local development.",
    "commits": [
      {
        "sha": "0123456789abcdef0123456789abcdef01234567",
        "subject": "Add local release-channel launcher foundation",
        "category": "feat",
        "scope": "launcher",
        "pr": 24
      },
      {
        "sha": "aaaaaaaaaaaaaaaaaaaaaaaaaaaaaaaaaaaaaaaa",
        "subject": "Verify artifacts before atomic installation",
        "category": "fix",
        "scope": "updates"
      }
    ]
  },
  "artifacts": [
    {
      "name": "launcher-local-dev.txt",
      "url": "artifacts/launcher-local-dev.txt",
      "sha256": "82ccacfeaababbbde5a852d16810b01f564c43d305be0bcb5e9bdac3888e7582",
      "size": 43
    }
  ]
}
