{
  "channel": "launcher",
  "version": "0.1.1",
  "gitSha": "828a953ddc18338085e61ed5f95191e3ef78e516",
  "releasedAt": "2026-08-25T17:40:41Z",
  "notes": {
    "summary": "The launcher now updates itself.",
    "commits": [
      {
        "sha": "828a953ddc18338085e61ed5f95191e3ef78e516",
        "subject": "Release launcher 0.1.1",
        "category": "change",
        "scope": null,
        "pr": null
      },
      {
        "sha": "d485f3f86e64d83ec2b3e32cc4739fdb25f05e87",
        "subject": "launcher 0.1.0",
        "category": "release",
        "scope": null,
        "pr": null
      }
    ]
  },
  "artifacts": [
    {
      "name": "SomethingBoundLauncher.exe",
      "url": "https://github.com/ohmitom/somethingbound-release/releases/download/v0.1.1/SomethingBoundLauncher.exe",
      "sha256": "bbf3fbe2a7ff3bd44ff4f7b2b997df2c7777e0255d997f266478f25a75e60542",
      "size": 13039855
    }
  ]
}
