{
  "channel": "playtest",
  "version": "0.3.0",
  "gitSha": "2df9524e93ed2a841f363c5a1a4f503156157f07",
  "releasedAt": "2026-08-26T08:33:57Z",
  "notes": {
    "summary": "The client now signs in against the authoritative SomethingBound server.",
    "commits": [
      {
        "sha": "2df9524e93ed2a841f363c5a1a4f503156157f07",
        "subject": "Merge the server-backed client session",
        "category": "change",
        "scope": null,
        "pr": null
      }
    ]
  },
  "artifacts": [
    {
      "name": "somethingbound-client-0.3.0.zip",
      "url": "https://github.com/ohmitom/somethingbound-release/releases/download/v0.3.0/somethingbound-client-0.3.0.zip",
      "sha256": "d5f5bb33b5f494a2b5f3cfa65f086fe773f8e630ee47525b0e772f8fe6c0a6e7",
      "size": 52228909
    }
  ]
}
